{
  "slug": "text-embedding-ada-002",
  "provider": "openai",
  "offering": "azure-openai",
  "family": "text-embedding-ada",
  "modelName": "text-embedding-ada-002",
  "version": "2",
  "deploymentName": "text-embedding-ada-002",
  "skus": [{ "name": "Standard", "capacity": 150 }],
  "displayName": "text-embedding-ada-002",
  "description": "Embeddings model, deployed in Foundry but not yet an in-scope capability of the platform.",
  "useCases": [],
  "tiers": [],
  "environments": [],
  "dataZone": "uk",
  "regions": ["uksouth"],
  "apiProfile": "embeddings",
  "capacityPolicy": { "min": 1, "max": 50, "default": 5 },
  "limitsDefault": { "requestsPerMinute": 60, "tokensPerDay": 100000 },
  "lifecycle": { "status": "proposed", "retirementDate": null },
  "eligibility": {
    "eligible": false,
    "reason": "RAG/embeddings are explicit Future/Unimplemented scope in the design pack, independent of this deployment existing in Foundry"
  },
  "links": []
}
