{
  "slug": "gpt-4o",
  "provider": "openai",
  "offering": "azure-openai",
  "family": "gpt-4o",
  "modelName": "gpt-4o",
  "version": "2024-11-20",
  "deploymentName": "gpt-4o",
  "skus": [
    { "name": "GlobalStandard", "capacity": 250, "tiers": ["research"] },
    {
      "name": "Standard",
      "tiers": ["team", "research"],
      "regions": ["uksouth"],
      "dataZone": "uk"
    }
  ],
  "displayName": "GPT-4o",
  "description": "Multimodal OpenAI model balancing speed, cost and capability across text and vision tasks.",
  "useCases": [
    "Chat assistants",
    "Document summarisation",
    "Image understanding"
  ],
  "tiers": ["research", "team"],
  "environments": ["sandbox", "infradev"],
  "dataZone": "uk",
  "regions": ["uksouth"],
  "apiProfile": "chat-completions",
  "capacityPolicy": {
    "min": 1,
    "max": 100,
    "default": 10,
    "environments": {
      "infradev": { "min": 1, "max": 5, "default": 1, "quota": 10 }
    }
  },
  "limitsDefault": { "requestsPerMinute": 60, "tokensPerDay": 100000 },
  "lifecycle": { "status": "available", "retirementDate": null },
  "eligibility": { "eligible": true, "reason": null },
  "links": [{ "text": "Best practice guide", "href": "/help/best-practice" }]
}
