{
  "slug": "gpt-5-mini",
  "provider": "openai",
  "offering": "azure-openai",
  "family": "gpt-5",
  "modelName": "gpt-5-mini",
  "version": "2025-08-07",
  "deploymentName": "gpt-5-mini",
  "skus": [{ "name": "GlobalStandard", "capacity": 10 }],
  "displayName": "GPT-5 mini",
  "description": "Mid-sized GPT-5 model balancing speed, cost and capability for everyday research tasks.",
  "useCases": ["Chat assistants", "Document summarisation", "Code generation"],
  "tiers": ["research"],
  "environments": ["sandbox"],
  "dataZone": "uk",
  "regions": ["uksouth"],
  "apiProfile": "chat-completions",
  "capacityPolicy": { "min": 1, "max": 100, "default": 10 },
  "limitsDefault": { "requestsPerMinute": 60, "tokensPerDay": 100000 },
  "lifecycle": { "status": "available", "retirementDate": null },
  "eligibility": { "eligible": true, "reason": null },
  "links": [{ "text": "Best practice guide", "href": "/help/best-practice" }]
}
